"Category","Description","Cost_Per_Person_HKD","Total_Cost_HKD"
"International Flights","Hong Kong <> Spain (Economy class, early booking, flexible dates)","5200","10400"
"Accommodation","19 nights (Private albergues, pensions, or rural houses)","4300","8600"
"Meals","21 days (Breakfast, Lunch, Dinner; includes Pilgrim's Menu)","4400","8800"
"Local Transportation","Spain (Airport to Sarria, local buses in Santiago)","600","1200"
"Miscellaneous & Emergency Reserve","Water, snacks, souvenirs, toiletries, laundry, coffee breaks, contingencies","500","1000"